<?xml version="1.0" encoding="UTF-8"?>
<!-- edited with XMLSpy v2013 rel. 2 sp2 (http://www.altova.com) by Yu Wang (NA) -->
<CommandTestScript xmlns:xsi="http://www.w3.org/2001/XMLSchema-instance" xsi:noNamespaceSchemaLocation="command_script.xsd" CommandDelayInterval="0">
	<Commands>
<Command xsi:type="CompositeCommand">
<Commands>
		<Command xsi:type="PassThroughCommand">
			<Data>ZA==</Data>
		</Command>
		<Command xsi:type="PassThroughCommand">
			<Data>bg==</Data>
		</Command>
		<Command xsi:type="SetSingleSwitchCommand">
			<SwitchIndex>0</SwitchIndex>
			<SwitchStatus>1</SwitchStatus>
		</Command>
		<Command xsi:type="SetSingleSwitchDelayCommand">
			<SwitchIndex>1</SwitchIndex>
			<SwitchStatus>1</SwitchStatus>
			<Delay>2</Delay>
		</Command>
		<Command xsi:type="SetSingleSwitchDelayCommand">
			<SwitchIndex>2</SwitchIndex>
			<SwitchStatus>1</SwitchStatus>
			<Delay>4</Delay>
		</Command>
		<Command xsi:type="SetSingleSwitchDelayCommand">
			<SwitchIndex>3</SwitchIndex>
			<SwitchStatus>1</SwitchStatus>
			<Delay>6</Delay>
		</Command>
		<Command xsi:type="PassThroughCommand">
			<Data>ZA==</Data>
		</Command>
		<Command xsi:type="PassThroughCommand">
			<Data>bg==</Data>
		</Command>
		</Commands>
		</Command>
  </Commands>
</CommandTestScript>
