<?xml version="1.0" encoding="UTF-8"?>
<!-- edited with XMLSpy v2013 rel. 2 sp2 (http://www.altova.com) by Yu Wang (NA) -->
<CommandTestScript xmlns:xsi="http://www.w3.org/2001/XMLSchema-instance" xsi:noNamespaceSchemaLocation="command_script.xsd" CommandDelayInterval="1">
	<Commands>
		<Command xsi:type="PassThroughCommand">
			<Data>ZQ==</Data>
		</Command>
		<Command xsi:type="PassThroughCommand">
			<Data>Zg==</Data>
		</Command>
		<Command xsi:type="PassThroughCommand">
			<Data>Zw==</Data>
		</Command>
		<Command xsi:type="PassThroughCommand">
			<Data>aA==</Data>
		</Command>
		<Command xsi:type="PassThroughCommand">
			<Data>bw==</Data>
		</Command>
		<Command xsi:type="PassThroughCommand">
			<Data>cA==</Data>
		</Command>
		<Command xsi:type="PassThroughCommand">
			<Data>cQ==</Data>
		</Command>
		<Command xsi:type="PassThroughCommand">
			<Data>cg==</Data>
		</Command>
		<Command xsi:type="PassThroughCommand">
			<Data>ZA==</Data>
		</Command>
		<Command xsi:type="PassThroughCommand">
			<Data>bg==</Data>
		</Command>
	</Commands>
</CommandTestScript>
